{"run":30,"commit":"best-re","metric":95.81,"metrics":{"lines_hit":526,"lines_found":549,"uncovered_lines":23},"status":"discard","description":"Rerun best kept rendezvous state under persisted constraints","timestamp":1778795262190,"segment":1,"confidence":null,"asi":{"hypothesis":"Persisted state shows the legitimate tests-only optimization is at a stable plateau; rerun current best to satisfy the iteration while avoiding overfit/artificial coverage tests.","rollback_reason":"Coverage matched the best kept 95.81% and did not improve.","next_action_hint":"Finalize or run fresh recon/review to find genuinely untested behavior before any further modifications."}}
{"run":31,"commit":"persist","metric":95.81,"metrics":{"lines_hit":526,"lines_found":549,"uncovered_lines":23},"status":"discard","description":"Rerun persisted best rendezvous coverage state","timestamp":1778795306593,"segment":1,"confidence":null,"asi":{"hypothesis":"Persisted autoresearch shows a stable tests-only plateau; the safest non-cheating iteration is to rerun the best kept state rather than fabricate tests for unreachable serde/SystemTime branches.","rollback_reason":"Coverage matched the best kept 95.81% and did not improve.","next_action_hint":"Finalize or run fresh recon/review before further code changes; direct reruns are expected to stay at 95.81%."}}
{"run":32,"commit":"plateau","metric":95.81,"metrics":{"lines_hit":526,"lines_found":549,"uncovered_lines":23},"status":"discard","description":"Rerun persisted plateau best rendezvous coverage","timestamp":1778795405694,"segment":1,"confidence":null,"asi":{"hypothesis":"The persisted state continues to show a stable plateau with no legitimate new tests-only hypothesis; rerun the current best as the safest compliant iteration.","rollback_reason":"Coverage matched the best kept 95.81% and did not improve.","next_action_hint":"Finalize or conduct fresh recon/review before changing tests; direct reruns are expected to remain stable at 95.81%."}}
